Resumption of the session	Wiederaufnahme der Sitzungsperiode
I declare resumed the session of the European Parliament adjourned on Friday 17 December 1999, and I would like once again to wish you a happy new year in the hope that you enjoyed a pleasant festive period.	Ich erkläre die am Freitag, dem 17. Dezember unterbrochene Sitzungsperiode des Europäischen Parlaments für wiederaufgenommen, wünsche Ihnen nochmals alles Gute zum Jahreswechsel und hoffe, daß Sie schöne Ferien hatten.
Although, as you will have seen, the dreaded 'millennium bug' failed to materialise, still the people in a number of countries suffered a series of natural disasters that truly were dreadful.	Wie Sie feststellen konnten, ist der gefürchtete "Millenium-Bug " nicht eingetreten. Doch sind Bürger einiger unserer Mitgliedstaaten Opfer von schrecklichen Naturkatastrophen geworden.
You have requested a debate on this subject in the course of the next few days, during this part-session.	Im Parlament besteht der Wunsch nach einer Aussprache im Verlauf dieser Sitzungsperiode in den nächsten Tagen.
In the meantime, I should like to observe a minute' s silence, as a number of Members have requested, on behalf of all the victims concerned, particularly those of the terrible storms, in the various countries of the European Union.	Heute möchte ich Sie bitten - das ist auch der Wunsch einiger Kolleginnen und Kollegen -, allen Opfern der Stürme, insbesondere in den verschiedenen Ländern der Europäischen Union, in einer Schweigeminute zu gedenken.
Please rise, then, for this minute' s silence.	Ich bitte Sie, sich zu einer Schweigeminute zu erheben.
(The House rose and observed a minute' s silence)	(Das Parlament erhebt sich zu einer Schweigeminute.)
Madam President, on a point of order.	Frau Präsidentin, zur Geschäftsordnung.
You will be aware from the press and television that there have been a number of bomb explosions and killings in Sri Lanka.	Wie Sie sicher aus der Presse und dem Fernsehen wissen, gab es in Sri Lanka mehrere Bombenexplosionen mit zahlreichen Toten.
One of the people assassinated very recently in Sri Lanka was Mr Kumar Ponnambalam, who had visited the European Parliament just a few months ago.	Zu den Attentatsopfern, die es in jüngster Zeit in Sri Lanka zu beklagen gab, zählt auch Herr Kumar Ponnambalam, der dem Europäischen Parlament erst vor wenigen Monaten einen Besuch abgestattet hatte.
Would it be appropriate for you, Madam President, to write a letter to the Sri Lankan President expressing Parliament's regret at his and the other violent deaths in Sri Lanka and urging her to do everything she possibly can to seek a peaceful reconciliation to a very difficult situation?	Wäre es angemessen, wenn Sie, Frau Präsidentin, der Präsidentin von Sri Lanka in einem Schreiben das Bedauern des Parlaments zum gewaltsamen Tod von Herrn Ponnambalam und anderen Bürgern von Sri Lanka übermitteln und sie auffordern würden, alles in ihrem Kräften stehende zu tun, um nach einer friedlichen Lösung dieser sehr schwierigen Situation zu suchen?
Yes, Mr Evans, I feel an initiative of the type you have just suggested would be entirely appropriate.	Ja, Herr Evans, ich denke, daß eine derartige Initiative durchaus angebracht ist.
If the House agrees, I shall do as Mr Evans has suggested.	Wenn das Haus damit einverstanden ist, werde ich dem Vorschlag von Herrn Evans folgen.
Madam President, on a point of order.	Frau Präsidentin, zur Geschäftsordnung.
I would like your advice about Rule 143 concerning inadmissibility.	Könnten Sie mir eine Auskunft zu Artikel 143 im Zusammenhang mit der Unzulässigkeit geben?
My question relates to something that will come up on Thursday and which I will then raise again.	Meine Frage betrifft eine Angelegenheit, die am Donnerstag zur Sprache kommen wird und auf die ich dann erneut verweisen werde.
The Cunha report on multiannual guidance programmes comes before Parliament on Thursday and contains a proposal in paragraph 6 that a form of quota penalties should be introduced for countries which fail to meet their fleet reduction targets annually.	Das Parlament wird sich am Donnerstag mit dem Cunha-Bericht über mehrjährige Ausrichtungsprogramme befassen, der in Absatz 6 vorschlägt, daß Länder, die ihr Soll zur Flottenverkleinerung nicht erfüllen, jährlich mit einer Art Quotenstrafe belegt werden sollen.
It says that this should be done despite the principle of relative stability.	Und zwar sollen derartige Strafen trotz des Grundsatzes der relativen Stabilität verhängt werden.
I believe that the principle of relative stability is a fundamental legal principle of the common fisheries policy and a proposal to subvert it would be legally inadmissible.	Ich meine, daß der Grundsatz der relativen Stabilität einen elementaren Rechtsgrundsatz der gemeinsamen Fischereipolitik darstellt und ein Vorschlag, diesen zu unterlaufen, rechtlich unzulässig wäre.
I want to know whether one can raise an objection of that kind to what is merely a report, not a legislative proposal, and whether that is something I can competently do on Thursday.	Ich möchte wissen, ob es möglich ist, einen Einwand gegen ein Dokument zu erheben, bei dem es sich lediglich um einen Bericht und keinen Legislativvorschlag handelt, und ob ich befugt bin, dies am Donnerstag zu tun.
That is precisely the time when you may, if you wish, raise this question, i.e. on Thursday prior to the start of the presentation of the report.	Genau dann können Sie, wenn Sie wollen, diese Frage ansprechen, d. h. am Donnerstag zu Beginn der Aussprache über den Bericht.
	Frau Präsidentin!
Madam President, coinciding with this year' s first part-session of the European Parliament, a date has been set, unfortunately for next Thursday, in Texas in America, for the execution of a young 34 year-old man who has been sentenced to death. We shall call him Mr Hicks.	Die erste diesjährige Tagung des Europäischen Parlaments fällt leider damit zusammen, daß in den Vereinigten Staaten, in Texas, für Donnerstag dieser Woche die Hinrichtung eines zum Tode verurteilten 34jährigen jungen Mannes namens Hicks festgelegt worden ist.
At the request of a French Member, Mr Zimeray, a petition has already been presented, which many people signed, including myself.	Auf Wunsch eines französischen Mitglieds, Herrn Zimeray, wurde bereits eine Petition eingereicht, die von vielen, auch von mir selbst, unterzeichnet worden ist.
However, I would ask you, in accordance with the line which is now constantly followed by the European Parliament and by the whole of the European Community, to make representations, using the weight of your prestigious office and the institution you represent, to the President and to the Governor of Texas, Mr Bush, who has the power to order a stay of execution and to reprieve the condemned person.	Gemäß der vom Europäischen Parlament und von der gesamten Europäischen Union nunmehr ständig vertretenen Linie möchte ich Sie jedoch bitten, den ganzen Einfluß Ihres Amtes und der Institution, die Sie vertreten, bei dem Präsidentschaftskandidaten und Gouverneur von Texas, George W. Bush, der zur Aussetzung der Vollstreckung des Todesurteils und zur Begnadigung des Verurteilten befugt ist, geltend zu machen.
This is all in accordance with the principles that we have always upheld.	All dies entspricht den Grundsätzen, die wir stets verteidigt haben.
Thank you, Mr Segni, I shall do so gladly.	Vielen Dank, Herr Segni, das will ich gerne tun.
Indeed, it is quite in keeping with the positions this House has always adopted.	Das ist ganz im Sinne der Position, die wir als Parlament immer vertreten haben.
Madam President, I should like to draw your attention to a case in which this Parliament has consistently shown an interest.	Frau Präsidentin! Ich möchte Sie auf einen Fall aufmerksam machen, mit dem sich dieses Parlament immer wieder befaßt hat.
It is the case of Alexander Nikitin.	Das ist der Fall von Alexander Nikitin.
All of us here are pleased that the courts have acquitted him and made it clear that in Russia, too, access to environmental information is a constitutional right.	Wir freuen uns hier alle, daß das Gericht ihn freigesprochen und deutlich gemacht hat, daß auch in Rußland der Zugang zu Umweltinformationen konstitutionelles Recht ist.
Now, however, he is to go before the courts once more because the public prosecutor is appealing.	Nun ist es aber so, daß er wieder angeklagt werden soll, weil der Staatsanwalt in Berufung geht.
We know, and we have stated as much in very many resolutions indeed, including specifically during the last plenary part-session of last year, that this is not solely a legal case and that it is wrong for Alexander Nikitin to be accused of criminal activity and treason because of our involvement as the beneficiaries of his findings.	Wir wissen und wir haben es in wirklich sehr vielen Entschließungen festgestellt - gerade während der letzten Plenartagung des vergangenen Jahres-, daß dies nicht nur ein juristischer Fall ist und daß es falsch ist, Alexander Nikitin Kriminalität und Verrat vorzuwerfen, weil wir als Betroffene von seinen Ergebnissen einen Nutzen haben.
These findings form the basis of the European programmes to protect the Barents Sea, and that is why I would ask you to examine a draft letter setting out the most important facts and to make Parliament's position, as expressed in the resolutions which it has adopted, clear as far as Russia is concerned.	Diese Ergebnisse sind die Grundlage für die europäischen Programme zum Schutz der Barentsee, und deswegen bitte ich Sie, einen Briefentwurf, der Ihnen die wichtigsten Fakten schildert, zu prüfen und im Sinne der Beschlüsse des Parlaments in Rußland diese Position deutlich zu machen.
Yes, Mrs Schroedter, I shall be pleased to look into the facts of this case when I have received your letter.	Frau Schroedter, ich bin gerne bereit, die damit zusammenhängenden Fakten zu prüfen, wenn mir Ihr Brief vorliegt.
Madam President, I would firstly like to compliment you on the fact that you have kept your word and that, during this first part-session of the new year, the number of television channels in our offices has indeed increased considerably.	Frau Präsidentin, zunächst besten Dank dafür, daß Sie Wort gehalten haben und nun in der ersten Sitzungsperiode des neuen Jahres das Angebot an Fernsehprogrammen in unseren Büros tatsächlich enorm erweitert ist.
But, Madam President, my personal request has not been met.	Dennoch, Frau Präsidentin, wurde meinem Wunsch nicht entsprochen.
Although there are now two Finnish channels and one Portuguese one, there is still no Dutch channel, which is what I had requested because Dutch people here like to be able to follow the news too when we are sent to this place of exile every month.	Zwar können wir jetzt zwei finnische und einen portugiesischen, nach wie vor aber keinen niederländischen Sender empfangen. Ich hatte Sie aber um ein niederländisches Programm gebeten, denn auch wir Niederländer möchten die Nachrichten verfolgen, wenn wir jeden Monat hierher in die Verbannung geschickt werden.
I would therefore once more ask you to ensure that we get a Dutch channel as well.	Deshalb möchte ich Sie nochmals ersuchen, dafür Sorge zu tragen, daß auch ein niederländischer Sender eingespeist wird.
Mrs Plooij-van Gorsel, I can tell you that this matter is on the agenda for the Quaestors' meeting on Wednesday.	Frau Plooij-van Gorsel, ich kann Ihnen mitteilen, daß dieser Punkt am Mittwoch auf der Tagesordnung der Quästoren steht.
It will, I hope, be examined in a positive light.	Ich hoffe, daß dort in Ihrem Sinne entschieden wird.
Madam President, can you tell me why this Parliament does not adhere to the health and safety legislation that it actually passes?	Frau Präsidentin, können Sie mir sagen, warum sich dieses Parlament nicht an die Arbeitsschutzregelungen hält, die es selbst verabschiedet hat?
Why has no air quality test been done on this particular building since we were elected?	Weshalb wurde die Luftqualität in diesem Gebäude seit unserer Wahl nicht ein einziges Mal überprüft?
Why has there been no Health and Safety Committee meeting since 1998?	Weshalb ist der Arbeitsschutzausschuß seit 1998 nicht ein einziges Mal zusammengetreten?
Why has there been no fire drill, either in the Brussels Parliament buildings or the Strasbourg Parliament buildings?	Warum hat weder im Brüsseler noch im Straßburger Parlamentsgebäude eine Brandschutzübung stattgefunden?
Why are there no fire instructions?	Warum finden keine Brandschutzbelehrungen statt?
Why have the staircases not been improved since my accident?	Warum wurde nach meinem Unfall nichts unternommen, um die Treppen sicherer zu machen?
Why are no-smoking areas not enforced?	Warum wird in den Nichtraucherzonen das Rauchverbot nicht durchgesetzt?
It seems absolutely disgraceful that we pass legislation and do not adhere to it ourselves.	Es ist eine Schande, daß wir Regeln verabschieden, an die wir uns dann selbst nicht halten.
Mrs Lynne, you are quite right and I shall check whether this has actually not been done.	Frau Lynne, Sie haben völlig recht, und ich werde prüfen, ob all dies wirklich so ist.
I shall also refer the matter to the College of Quaestors, and I am certain that they will be keen to ensure that we comply with the regulations we ourselves vote on.	Ich werde die Frage auch den Quästoren unterbreiten. Ich bin mir sicher, daß diese großen Wert darauf legen, daß wir die Rechtsvorschriften, die wir verabschieden, auch selbst einhalten.
Madam President, Mrs Díez González and I had tabled questions on certain opinions of the Vice-President, Mrs de Palacio, which appeared in a Spanish newspaper.	Frau Präsidentin! Frau Díez González und ich hatten einige Anfragen zu bestimmten, in einer spanischen Zeitung wiedergegebenen Stellungnahmen der Vizepräsidentin, Frau de Palacio, gestellt.
The competent services have not included them in the agenda on the grounds that they had been answered in a previous part-session.	Die zuständigen Dienste haben sie nicht in die Tagesordnung aufgenommen, da sie der Meinung waren, sie seien schon in einer vorangegangenen Sitzung beantwortet worden.
I would ask that they reconsider, since this is not the case.	Ich bitte, diese Entscheidung zu überdenken, weil das nicht der Fall ist.
The questions answered previously referred to Mrs de Palacio' s intervention, on another occasion, and not to these comments which appeared in the ABC newspaper on 18 November.	Die früher beantworteten Anfragen bezogen sich auf das Auftreten von Frau de Palacio in einer bestimmten Angelegenheit, nicht auf die am 18. November des vergangenen Jahres in der Tageszeitung ABC erschienenen Erklärungen.
Mr Berenguer Fuster, we shall check all this.	Lieber Kollege, wir werden das prüfen.
I admit that, at present, the matter seems to be somewhat confused.	Ich muß Ihnen aber sagen, daß ich die Lage im Moment für etwas verworren halte.
We shall therefore look into it properly to ensure that everything is as it should be.	Wir werden das aber sehr genau prüfen, damit alles seine Richtigkeit hat.
Madam President, I should like to know if there will be a clear message going out from Parliament this week about our discontent over today's decision refusing to renew the arms embargo on Indonesia, considering that the vast majority in this Parliament have endorsed the arms embargo in Indonesia in the past?	Frau Präsidentin, ich wüßte gern, ob das Parlament in dieser Woche ein deutliches Signal unserer Unzufriedenheit bezüglich der heutigen Entscheidung, mit der eine Verlängerung des Waffenembargos gegen Indonesien abgelehnt wird, aussenden wird, zumal sich die große Mehrheit in diesem Parlament in der Vergangenheit für das Waffenembargo gegen Indonesien ausgesprochen hat.
Today's decision not to renew the embargo is extremely dangerous considering the situation there.	Die heutige Entscheidung gegen eine Verlängerung des Embargos birgt angesichts der dortigen Lage eine sehr große Gefahr.
So Parliament should send a message, since that is the wish of the vast majority.	Das Parlament sollte, da dies dem Wunsch der großen Mehrheit entspricht, eine entsprechende Botschaft senden.
It is irresponsible of EU Member States to refuse to renew the embargo.	Die Ablehnung einer Verlängerung des Embargos seitens der EU-Mitgliedstaaten ist unverantwortlich.
As people have said, the situation there is extremely volatile.	Wie bereits festgestellt wurde, ist die Lage in Indonesien äußerst instabil.
There is, in fact, a risk of a military coup in the future.	Es besteht sogar die Gefahr eines Militärputsches.
We do not know what is happening.	Wir wissen nicht, was passiert.
So why should EU arms producers profit at the expense of innocent people?	Weshalb also sollten Waffenhersteller in der EU auf Kosten unschuldiger Menschen Profite einstreichen?
In any event, this question is not presently included among the requests for topical and urgent debate on Thursday.	Dieser Punkt ist bisher nicht für die Dringlichkeitsdebatte am Donnerstag vorgesehen.
Agenda	Arbeitsplan
The next item is the verification of the final version of the draft agenda as drawn up by the Conference of Presidents at its meeting of 13 January pursuant to Rule 110 of the Rules of Procedure.	Nach der Tagesordnung folgt die Prüfung des endgültigen Entwurfs der Tagesordnung, wie er nach Artikel 110 der Geschäftsordnung am Donnerstag, dem 13. Januar von der Konferenz der Präsidenten festgelegt wurde.
No amendments have been proposed relating to Monday and Tuesday.	Zu Montag und Dienstag liegen keine Änderungen vor.
Relating to Wednesday:	Zum Mittwoch:
The Group of the Party of European Socialists requests that a Commission statement be included on its strategic objectives for the next five years and on the administrative reform of the Commission.	Die Sozialdemokratische Fraktion beantragt, eine Erklärung der Kommission über ihre strategischen Ziele für die nächsten fünf Jahre sowie über die Verwaltungsreform der Kommission in die Tagesordnung aufzunehmen.
I would like Mr Barón Crespo, who made the request, to speak to propose it. That is, if he so wishes, of course.	Ich bitte den Antragsteller, Herrn Barón Crespo, seinen Antrag zu begründen, falls er dies wünscht.
Then we shall follow the usual procedure, hearing one speaker in favour and one against.	Danach verfahren wir wie üblich: ein Redner dafür, einer dagegen.
Madam President, the presentation of the Prodi Commission' s political programme for the whole legislature was initially a proposal by the Group of the Party of European Socialists which was unanimously approved by the Conference of Presidents in September and which was also explicitly accepted by President Prodi, who reiterated his commitment in his inaugural speech.	Frau Präsidentin! Die Vorstellung des politischen Programms der Kommission Prodi für die gesamte Wahlperiode ging auf einen Vorschlag der Fraktion der Sozialdemokratischen Partei Europas zurück, der die einhellige Billigung der Konferenz der Präsidenten im September und auch die ausdrückliche Zustimmung von Präsident Prodi fand, der seine Zusage in seiner Antrittsrede bekräftigte.
This commitment is important because the Commission is a body with a monopoly of initiative in accordance with the Treaties and, therefore, basically dictates this Parliament' s political and legislative activity for the next five years.	Diese Zusage ist insofern von Bedeutung, als die Kommission ein Organ ist, das nach den Verträgen das Initiativmonopol besitzt und somit grundlegend die politische und legislative Tätigkeit dieses Parlaments in den nächsten fünf Jahren gestaltet.
I would also like to point out, Madam President, that this Parliament voted to express its confidence in President Prodi during the previous legislature. It did so again during this legislature, in July, and then, in September, it voted once more to approve the whole Commission.	Ich möchte auch daran erinnern, daß dieses Parlament in der vorangegangenen Wahlperiode Präsident Prodi zweimal sein Vertrauen ausgesprochen hat; in dieser Wahlperiode sprach es ihm im Juli erneut sein Vertrauen aus, und dann, als die neue Kommission im Amt war, gab es im September erneut ein Vertrauensvotum für die Kommission insgesamt.
There has therefore been enough time for the Commission to prepare its programme and for us to become familiar with it and explain it to our citizens.	Somit hatte die Kommission bereits genügend Zeit, ihr Programm zu erarbeiten, und wir, um es kennenlernen und den Bürgern erklären zu können.
To this end, I would like to remind you of the resolution of 15 September, which recommended that the proposal be presented as soon as possible.	In diesem Sinne erinnere ich an die Entschließung vom 15. September, in der empfohlen wurde, den Vorschlag in der kürzestmöglichen Frist vorzulegen.
The events of last week - which originated outside the Conference of Presidents, that Conference being used simply to corroborate and ratify decisions taken elsewhere - present us with a dilemma. Either the Commission is not ready to present this programme, in which case it should clarify it.	Die Ereignisse der vergangenen Woche - die am Rande der Konferenz der Präsidenten ihren Anfang nahmen und wobei diese Konferenz nur zur Bestätigung und Ratifizierung von außerhalb gefaßten Beschlüssen genutzt wurde - verdeutlichen ein Dilemma: Entweder ist die Kommission nicht in der Lage, dieses Programm vorzulegen (In diesem Fall sollte sie eine Klärung herbeiführen.
According to its President, it is in a position to do so.	Nach den Worten ihres Präsidenten ist sie dazu in der Lage.
Given that the Commission is represented by Vice-President de Palacio, I believe that, before voting, it would help if the Commission could let us know how ready it is to present this programme, as agreed. Alternatively, Parliament is not ready to examine this programme, as some appear to be suggesting.	Da die Kommission durch die Vizepräsidentin, Frau de Palacio, vertreten ist, halte ich es für zweckmäßig, vor der Abstimmung die Position der Kommission hinsichtlich ihrer Bereitschaft zur Vorstellung des Programms, so wie es vereinbart war, zu erfahren.), oder das Parlament ist zur Prüfung dieses Programms nicht in der Lage, wie einige offenbar vorgeben.
In my opinion, this second hypothesis would imply the failure of Parliament in its duty as a Parliament, as well as introducing an original thesis, an unknown method which consists of making political groups aware, in writing, of a speech concerning the Commission' s programme a week earlier - and not a day earlier, as had been agreed - bearing in mind that the legislative programme will be discussed in February, so we could forego the debate, since on the next day our citizens will hear about it in the press and on the Internet and Parliament will no longer have to worry about it.	Nach meiner Ansicht würde diese zweite Hypothese einem Verzicht auf unsere Verantwortung als Parlament und darüber hinaus dem Aufwerfen einer originellen These, einer unbekannten Methode gleichkommen, die darin bestände, den Fraktionen die programmatische Rede der Kommission in schriftlicher Form eine Woche vorher - und nicht, wie vereinbart, am Tag zuvor - zur Kenntnis zu geben, wobei zu berücksichtigen ist, daß das Legislativprogramm im Februar diskutiert werden wird, so daß wir auf die Aussprache verzichten könnten, da die Presse und das Internet am Tag darauf alle Bürger darüber informiert haben würden und das Parlament keinen Grund mehr hätte, sich mit der Angelegenheit zu befassen.
My Group believes that since a parliament is meant to listen, debate and reflect, there can be no justification whatsoever for this delay and we believe that, if the Commission is ready to do so, we still have time to re-establish the original agreement between Parliament and the Commission and proceed in a manner which fulfils our duty to our fellow citizens.	Da meine Fraktion der Meinung ist, daß ein Parlament dazu da ist, zuzuhören, zu diskutieren und nachzudenken, gibt es unserer Ansicht nach keinen Grund zur Rechtfertigung dieser Verzögerung, und wir glauben, wenn die Kommission dazu in der Lage ist, liegen wir genau in der Zeit, um die ursprüngliche Vereinbarung zwischen dem Parlament und der Kommission wieder in Kraft zu setzen und verantwortungsbewußt vor unsere Mitbürgerinnen und Mitbürgern treten zu können.
Therefore, the proposal of the Group of the Party of European Socialists, and which you have mentioned, is that the Prodi Commission present its legislative programme on Wednesday, including its proposed administrative reform, because, otherwise, we could find ourselves in a paradoxical situation: on the pretext that there is no text, on the one hand, the President of the Commission would be denied his right to speak in this Parliament and, on the other hand, there would be a debate on a reform when Parliament had no prior knowledge of the texts on which it is based.	Deshalb besteht der Vorschlag der Fraktion der Sozialdemokratischen Partei Europas, den Sie erwähnt haben, darin, den Mittwoch als Termin der Vorstellung des Programms der Kommission Prodi für die Wahlperiode beizubehalten, und in dieses Programm auch das Verwaltungsreformprojekt einzubeziehen, da wir andernfalls in eine paradoxe Situation geraten könnten: Mit der Ausrede, der Wortlaut liege nicht vor, wird einerseits dem Präsidenten der Kommission das Recht abgesprochen, in diesem Parlament zu sprechen, und andererseits würde eine Aussprache über die Reform stattfinden, ohne daß dieses Parlament zuvor die Texte lesen konnte, die der Aussprache zugrunde liegen.
