Therefore, Madam President, I would ask you to request that the Commission express its opinion on this issue and that we then proceed to the vote.	Daher bitte ich Sie, Frau Präsidentin, die Kommission zu ersuchen, sich jetzt zu äußern, und danach zur Abstimmung zu schreiten.
(Applause from the PSE Group)	(Beifall der PSE-Fraktion)
Madam President, I really am quite astonished at Mr Barón Crespo' s behaviour and the fact that he is now asking for this item to be put on Wednesday's agenda.	Frau Präsidentin, liebe Kolleginnen und Kollegen! Ich bin doch etwas erstaunt über das Verhalten des Kollegen Barón Crespo, der jetzt verlangt, daß dieser Tagesordnungspunkt auf die Tagesordnung für Mittwoch gesetzt wird.
Mr Barón Crespo, you were unable to attend the Conference of Presidents last Thursday.	Herr Kollege Barón Crespo, Sie konnten am letzten Donnerstag in der Konferenz der Präsidenten nicht anwesend sein.
I am not criticising this; it happens from time to time that people send someone to represent them.	Das kritisiere ich nicht; es kommt immer mal vor, daß man sich vertreten läßt.
Mr Hänsch represented you on this occasion.	Der Kollege Hänsch hat Sie dort vertreten.
In the Conference of Presidents, we had an in-depth discussion.	Wir haben in der Konferenz der Präsidenten eine ausführliche Debatte geführt.
Your Group was alone in advocating what you are saying now.	Nur Ihre Fraktion hat das vertreten, was Sie jetzt sagen.
We then put it to a vote.	Wir haben dann abgestimmt.
As you know, each chairman has the same number of votes as his Group has Members.	Jeder Vorsitzende bzw. jede Vorsitzende hat ja so viele Stimmen, wie die Fraktion Mitglieder hat.
There was a vote on this matter.	Es gab eine Abstimmung zu diesem Punkt.
As I recall, the outcome of this vote was 422 votes to 180 with a few abstentions.	Diese Abstimmung ist meiner Erinnerung nach so ausgegangen: 422 gegen 180 Stimmen bei einigen wenigen Enthaltungen.
This means that all the Groups with the exception of the non-attached Members - but, of course, they are not a Group - were in agreement; only your Group thought that we should proceed as you have proposed here.	Das heißt, alle Fraktionen, mit Ausnahme der Fraktionslosen - aber die sind ja keine Fraktion - waren sich einig, nur Ihre Fraktion war der Meinung, so zu verfahren, wie Sie es hier vorgeschlagen haben.
All of the others were of a different opinion.	Alle anderen waren anderer Meinung.
That was the decision.	Das war der Beschluß.
